{"schema_version":1,"context":{"request_id":"request-1","session_id":"session-1","agent_id":"agent-1","content_ref":"blake3:content","tenant_id":null},"surface":"proxy","direction":"input","provider":"openai","model":"gpt-5","token_balance":{"original_tokens":100,"materialized_tokens":80,"delivered_tokens":60,"provider_billed_tokens":60},"route_ref":"route-1","policy_ref":null,"idempotency_key":"request-1:input"}